{
  "schema": "agentos.setup-scenario/v1",
  "id": "ssh-vnc-tunnel",
  "version": "1.0.0",
  "title": "Connect to a device with SSH or VNC over SSH",
  "goal": "Reach one authorized device quickly by reusing a verified SSH route, or set up the shortest suitable route; add a protected desktop connection only when needed.",
  "implementation_status": "guide_only",
  "evidence": {
    "level": "documented",
    "scope": "OpenSSH, Microsoft, Apple and RFB primary documentation was reviewed. A private reverse-tunnel implementation informed the proof layers, but no universal adapter or new device login was verified.",
    "reviewed_on": "2026-09-26",
    "sources": [
      "https://man.openbsd.org/ssh",
      "https://man.openbsd.org/ssh_config",
      "https://man.openbsd.org/sshd_config",
      "https://learn.microsoft.com/en-us/windows-server/administration/openssh/openssh_install_firstuse",
      "https://support.apple.com/guide/mac-help/mchlp1066/mac",
      "https://support.apple.com/guide/mac-help/mh11848/mac",
      "https://www.rfc-editor.org/info/rfc6143/"
    ]
  },
  "prerequisites": [
    "Know the exact owner-authorized target device and whether shell access, desktop access, or both are wanted.",
    "Check the selected user's existing connection records and SSH aliases first; treat an old route as a candidate until current identity and access are verified.",
    "Use a verified operator identity and host key. Keep private keys, passwords, device addresses and per-user routes outside the public card."
  ],
  "flows": [
    {
      "id": "known-route",
      "when": "An exact, previously verified SSH alias or connection record exists for this device.",
      "steps": [
        {
          "id": "select",
          "actor": "agent",
          "action": "Load only the exact device record and its last verified route. Confirm the requested capability and operator authority; do not search every host or ask again for already verified details.",
          "proof": "The target identity, route, authority and last verification date are explicit."
        },
        {
          "id": "recheck",
          "actor": "agent",
          "action": "Check the current host key and run a bounded authenticated SSH identity probe through that route. If desktop was requested, continue with the desktop flow.",
          "proof": "Authentication succeeds and the response identifies the intended device. A TCP or SSH banner alone is insufficient."
        }
      ]
    },
    {
      "id": "new-ssh-route",
      "when": "No verified route exists, or the prior route is stale or fails.",
      "steps": [
        {
          "id": "choose",
          "actor": "agent",
          "action": "Choose direct SSH when reachable; otherwise use an already trusted jump host. Use a reverse SSH forward only when the device cannot accept inbound access and an authorized broker is available. Explain the single chosen path and ask only for missing facts.",
          "proof": "The selected path has an exact target, verified broker if any, and no unnecessary new account or tunnel."
        },
        {
          "id": "prepare",
          "actor": "agent",
          "action": "Check the target SSH service and selected operator identity. If setup is needed, present the exact rights change and use a separately authorized platform flow; leave unavoidable OS approval to the person. For a reverse route, restrict forwarding on the broker and bind its listener to loopback only.",
          "proof": "The service and account have the intended scope, required approval is recorded, and the broker's effective listener is loopback-only."
        },
        {
          "id": "verify",
          "actor": "agent",
          "action": "Verify the target and broker host keys through a trusted source, then test listener reachability and a bounded authenticated SSH identity command using the approved path.",
          "proof": "Transport and authenticated device identity are recorded separately; the SSH command succeeds on the exact target."
        }
      ]
    },
    {
      "id": "desktop-over-ssh",
      "when": "The person requests a graphical desktop and SSH access to the exact device is verified.",
      "steps": [
        {
          "id": "prepare-desktop",
          "actor": "agent",
          "action": "Check the device's VNC or screen-sharing service and selected users. If setup is needed, use a separately authorized platform flow and guide the person through any OS approval. Protect the service from public exposure.",
          "proof": "The desktop service and permitted user are known, required approval is recorded, and raw VNC is not published to the Internet."
        },
        {
          "id": "forward",
          "actor": "agent",
          "action": "Create a local loopback-bound SSH forward from the viewer to the device's VNC endpoint through the verified SSH route, with forwarding failure detection.",
          "proof": "The local forwarded port answers with an RFB banner while the SSH tunnel is live. This proves transport only."
        },
        {
          "id": "view",
          "actor": "person",
          "action": "Authenticate with the approved VNC or screen-sharing account and confirm a current desktop frame from the intended device.",
          "proof": "Authentication and an actual desktop frame succeed; a banner, black frame or locked console is not reported as usable desktop access."
        }
      ]
    }
  ],
  "sensitive_inputs": [
    "SSH private keys and passphrases",
    "SSH host key fingerprints and device addresses",
    "broker credentials and connection aliases",
    "VNC or screen-sharing credentials",
    "device and user identity records"
  ],
  "recovery": [
    "If an old alias fails, revalidate the exact device and host key before changing the route; never suppress host-key warnings for speed.",
    "If a tunnel or banner works but SSH authentication fails, inspect the selected account and key without claiming device access.",
    "If SSH works but desktop does not, check the local desktop service, forward binding, viewer authentication and console state independently.",
    "Stop temporary forwards when finished. Remove only access created for this connection and record how the owner can revoke the key, broker authorization or desktop permission."
  ],
  "maintenance": {
    "owner": "AgentOS community maintainers",
    "review_triggers": [
      "OpenSSH forwarding or host-key guidance changes",
      "Windows or macOS SSH/screen-sharing setup changes",
      "RFB or VNC security guidance changes",
      "a verified route, device identity or credential is changed or revoked",
      "a tunnel succeeds while authentication or desktop access fails",
      "scheduled primary-source review"
    ]
  }
}
