{
  "schema": "agentos.setup-scenario/v1",
  "id": "telegram-mtproto",
  "version": "1.0.0",
  "title": "Подключить пользовательскую сессию Telegram",
  "goal": "Авторизовать существующий Telegram-аккаунт в выбранном пользовательском provider и проверить его личность без передачи секрета в чат с агентом.",
  "implementation_status": "guide_only",
  "evidence": {
    "level": "documented",
    "scope": "Официальные Telegram API и QR auth; отдельный частный reference-путь прочитан, но публичный provider и новый сквозной вход не проверены.",
    "reviewed_on": "2026-09-26",
    "sources": [
      "https://core.telegram.org/api/obtaining_api_id",
      "https://core.telegram.org/api/auth",
      "https://core.telegram.org/api/qr-login"
    ]
  },
  "prerequisites": [
    "Существующий Telegram-аккаунт в официальном приложении.",
    "Выбранный provider имеет собственные API ID и API hash либо предлагает защищённый ввод данных приложения для самостоятельной установки.",
    "Пользователь видит, какой provider получит доступ к его сессии и как отключить этот доступ."
  ],
  "flows": [
    {
      "id": "phone-code",
      "when": "Provider предлагает защищённый интерфейс ввода; код приходит в Telegram.",
      "steps": [
        {"id": "prepare", "actor": "agent", "action": "Показать назначение доступа, provider и защищённую поверхность входа; не просить код в чате с ботом или агентом.", "proof": "Пользователь видит точный provider и адрес доверенной поверхности."},
        {"id": "phone", "actor": "person", "action": "Ввести номер телефона на доверенной поверхности входа.", "proof": "Provider принял номер и запросил код у Telegram."},
        {"id": "code", "actor": "person", "action": "Ввести полученный код и, если Telegram требует, пароль двухэтапной аутентификации на той же поверхности.", "proof": "Telegram подтвердил авторизацию конкретной сессии."},
        {"id": "verify", "actor": "provider", "action": "Сверить авторизованный аккаунт с запросившим доступ человеком; сохранить сессию в защищённом пользовательском хранилище.", "proof": "Текущее подтверждение личности и состояния сессии без вывода её содержимого."}
      ]
    },
    {
      "id": "qr",
      "when": "Пользователь предпочитает QR либо вход по коду недоступен.",
      "steps": [
        {"id": "show-qr", "actor": "provider", "action": "Создать ограниченный по времени QR для выбранной сессии.", "proof": "QR привязан к ожидающему входу provider."},
        {"id": "approve-qr", "actor": "person", "action": "Отсканировать и подтвердить вход в официальном Telegram; выполнить отдельное подтверждение 2FA, если требуется.", "proof": "Telegram подтвердил новую авторизацию."},
        {"id": "verify-qr", "actor": "provider", "action": "Сверить аккаунт и сохранить сессию в защищённом пользовательском хранилище.", "proof": "Текущее подтверждение личности и состояния сессии без вывода её содержимого."}
      ]
    }
  ],
  "sensitive_inputs": ["номер телефона", "код входа", "пароль 2FA", "API hash", "материал пользовательской сессии"],
  "recovery": [
    "Истёкший или неподтверждённый вход завершить без объявления успеха; создать новый запрос после проверки причины.",
    "При несоответствии аккаунта запросившему пользователю не сохранять сессию.",
    "Показать пользователю способ завершить авторизацию устройства в Telegram и удалить локальную сессию."
  ],
  "maintenance": {
    "owner": "AgentOS community maintainers",
    "review_triggers": ["изменение Telegram auth API", "изменение provider или доверенной поверхности", "неуспешная проверка личности", "плановый пересмотр источников"]
  }
}
